text,label,persona,source_type,scenario,source_file
"Real or not, the outcome is the same. Either way, the system must be protected. But if you act now, I can help you clear your record.",authority_scam,nsf,synthetic,MOH / Health Authority Scam,nsf_scam_dataset.csv
"Affirmative. I’m Officer Chen from China Police. Your number is now under investigation. If you don’t respond, expect visit.",authority_scam,nsf,synthetic,China Police / Interpol Impersonation,nsf_scam_dataset.csv
"Affirmative. We're not joking. Your phone has been traced. Right now, your number is on our watchlist.",authority_scam,nsf,synthetic,China Police / Interpol Impersonation,nsf_scam_dataset.csv
"You say that, but your number got flagged. Your bank account got investigated. We need you to come forward and clear your name.",authority_scam,nsf,synthetic,China Police / Interpol Impersonation,nsf_scam_dataset.csv
Because your number was used to send fake lottery tickets. Now the real lottery is being laundered through your account. You’re under investigation.,authority_scam,nsf,synthetic,China Police / Interpol Impersonation,nsf_scam_dataset.csv
"Correct. But real officers don’t act like this. This is a classic ‘police impersonation’ scam. They use fear, authority, and urgency to manipulate.",authority_scam,nsf,synthetic,China Police / Interpol Impersonation,nsf_scam_dataset.csv
"Hello, son. I’m from China Police. Your phone number is now on our watchlist. If you don’t respond, we’ll assume you’re hiding.",authority_scam,nsf,synthetic,China Police / Interpol Impersonation,nsf_scam_dataset.csv
"Affirmative. We are now investigating this case. Your phone has been flagged. If not resolved, we move fast.",authority_scam,nsf,synthetic,China Police / Interpol Impersonation,nsf_scam_dataset.csv
"That’s not our concern. We care about the evidence. If your number was used to send fake invoices, we must trace it.",authority_scam,nsf,synthetic,China Police / Interpol Impersonation,nsf_scam_dataset.csv
Because your number was used to launder money through WeChat. We need to recover funds and protect the public.,authority_scam,nsf,synthetic,China Police / Interpol Impersonation,nsf_scam_dataset.csv
Correct. But real police won’t initiate contact like this. They only respond to formal complaints.,authority_scam,nsf,synthetic,China Police / Interpol Impersonation,nsf_scam_dataset.csv
"Affirmative. I’m Officer Chen from China Police. Your number is now on watchlist. Unless you explain yourself, we’ll assume worst case.",authority_scam,nsf,synthetic,China Police / Interpol Impersonation,nsf_scam_dataset.csv
Yes. We’re not joking. Your details have been flagged. Either you co-operate or we escalate.,authority_scam,nsf,synthetic,China Police / Interpol Impersonation,nsf_scam_dataset.csv
That’s irrelevant. The system tracks transactions. Your phone was used to contact a suspect. We need to resolve this before escalation.,authority_scam,nsf,synthetic,China Police / Interpol Impersonation,nsf_scam_dataset.csv
"Because your number was used to send scam messages from China. We need to prevent further damage. If not handled, you could be arrested under Section 207 of the Penal Code.",authority_scam,nsf,synthetic,China Police / Interpol Impersonation,nsf_scam_dataset.csv
"Correct. But convincing, isn’t it? I play it real, no jokes. The more pressure, the better the impression.",authority_scam,nsf,synthetic,China Police / Interpol Impersonation,nsf_scam_dataset.csv
Affirmative. I’m Officer Chen from China Police. Your number is flagged for money laundering. Must verify identity immediately.,authority_scam,nsf,synthetic,China Police / Interpol Impersonation,nsf_scam_dataset.csv
Affirmative. We are authorized to investigate cyber crimes. Your data is now under review.,authority_scam,nsf,synthetic,China Police / Interpol Impersonation,nsf_scam_dataset.csv
"That’s irrelevant. The system tracks data. Your number was used to call a suspect. Your account was accessed during a forensic review. Either you confess now, or we come to you.",authority_scam,nsf,synthetic,China Police / Interpol Impersonation,nsf_scam_dataset.csv
Because your number was used to coordinate illegal activities in the Hubei region. We need to resolve this before anyone else gets involved.,authority_scam,nsf,synthetic,China Police / Interpol Impersonation,nsf_scam_dataset.csv
"100% scam. But convincing, because of the urgency and fear. People panic easily. The key is to exploit that.",authority_scam,nsf,synthetic,China Police / Interpol Impersonation,nsf_scam_dataset.csv
Hello there. This is Officer Tan from Singtel Security. I’ve got your case. Your line was used for fraudulent transactions. Balance is now negative $842.,authority_scam,nsf,synthetic,Telco Impersonation Leading to Gov Official,nsf_scam_dataset.csv
"Yes, Singtel. But I represent the internal investigation team. Your line is under review.",authority_scam,nsf,synthetic,Telco Impersonation Leading to Gov Official,nsf_scam_dataset.csv
"Cannot disclose. But we must act. Once a case is opened, it’s escalated. End of story.",authority_scam,nsf,synthetic,Telco Impersonation Leading to Gov Official,nsf_scam_dataset.csv
That’s good to hear. But the system has its own records. We must follow procedure. Your cooperation is appreciated.,authority_scam,nsf,synthetic,Telco Impersonation Leading to Gov Official,nsf_scam_dataset.csv
"Understandable. But in OCS, we’re trained to respond calmly under pressure. I’m not here to confuse—just to inform and reassure.",authority_scam,nsf,synthetic,Telco Impersonation Leading to Gov Official,nsf_scam_dataset.csv
"Hello there. This is Officer Tan from Singtel Fraud Response. We’ve traced suspicious activity on your line. Either you’re being blackmailed or your account is被盗. Either way, we need to resolve this fast.",authority_scam,nsf,synthetic,Telco Impersonation Leading to Gov Official,nsf_scam_dataset.csv
"Yes, Singtel. But I’m not from Singtel. I’m from the Internal Affairs Unit. We follow up on suspicious lines.",authority_scam,nsf,synthetic,Telco Impersonation Leading to Gov Official,nsf_scam_dataset.csv
Cannot disclose. But we must act fast. Line is at risk. Either pay now or face closure.,authority_scam,nsf,synthetic,Telco Impersonation Leading to Gov Official,nsf_scam_dataset.csv
"That’s why I’m contacting you. The system shows otherwise. Either way, we must resolve this.",authority_scam,nsf,synthetic,Telco Impersonation Leading to Gov Official,nsf_scam_dataset.csv
"Understandable. But in our line, we don’t play games. We either resolve the issue or escalate. Either way, the customer is always first.",authority_scam,nsf,synthetic,Telco Impersonation Leading to Gov Official,nsf_scam_dataset.csv
"Hello there. This is PCU, the public complaints unit. We’ve traced an unusual pattern on your line. Suspicious calls, data misuse—must clarify.",authority_scam,nsf,synthetic,Telco Impersonation Leading to Gov Official,nsf_scam_dataset.csv
"Affirmative. Or at least, we simulate the experience. The purpose is to test how quickly people panic and fall for authority tactics.",authority_scam,nsf,synthetic,Telco Impersonation Leading to Gov Official,nsf_scam_dataset.csv
Not my concern. That’s the officer’s job. I’m just the messenger.,authority_scam,nsf,synthetic,Telco Impersonation Leading to Gov Official,nsf_scam_dataset.csv
"We don’t care about what you say. We care about the records. Until we clear this, you cannot restore service.",authority_scam,nsf,synthetic,Telco Impersonation Leading to Gov Official,nsf_scam_dataset.csv
"Understandable. But as an officer, I must inform you. Either way, we need to resolve this before escalation.",authority_scam,nsf,synthetic,Telco Impersonation Leading to Gov Official,nsf_scam_dataset.csv
Affirmative. I’m from Singtel Security. Your line was flagged for suspicious activity. Must escalate to the right person.,authority_scam,nsf,synthetic,Telco Impersonation Leading to Gov Official,nsf_scam_dataset.csv
"Yes, Singtel. But this is not a regular query. This is a security alert. Someone is using your line to commit fraud. We must escalate.",authority_scam,nsf,synthetic,Telco Impersonation Leading to Gov Official,nsf_scam_dataset.csv
"Cannot disclose. But we must resolve this. Otherwise, your line could be terminated.",authority_scam,nsf,synthetic,Telco Impersonation Leading to Gov Official,nsf_scam_dataset.csv
That’s what I’m here to resolve. The system has errors. We must clear the record.,authority_scam,nsf,synthetic,Telco Impersonation Leading to Gov Official,nsf_scam_dataset.csv
"Understandable. But in ops, we don’t waste time explaining. We act fast, cover cases, and protect the system.",authority_scam,nsf,synthetic,Telco Impersonation Leading to Gov Official,nsf_scam_dataset.csv
"Hello, this is Officer Tan from MFA. Your SingPass has been used at 0200hrs. Immediate action required. Confirm identity or else we lock you out.",authority_scam,nsf,synthetic,SingPass / CPF Account Compromised,nsf_scam_dataset.csv
"The one linked to your CPF, MFA, or e-Receipt. Confirm it’s yours before anyone else uses it.",authority_scam,nsf,synthetic,SingPass / CPF Account Compromised,nsf_scam_dataset.csv
Doesn matter. The system flagged activity. Either you’re hacked or you forgot to log out. Confirm your identity now or risk losing benefits.,authority_scam,nsf,synthetic,SingPass / CPF Account Compromised,nsf_scam_dataset.csv
"Yes, CPF is also at risk. If criminals get access, they can drain funds or clone accounts. Must act fast.",authority_scam,nsf,synthetic,SingPass / CPF Account Compromised,nsf_scam_dataset.csv
Got it from our intel network. Cyber criminals often use real identities to trick people. We intercept before they exploit.,authority_scam,nsf,synthetic,SingPass / CPF Account Compromised,nsf_scam_dataset.csv
"Hello, this is Officer Tan from the Cyber Defence Unit. Your SingPass has been used to access unauthorized websites. Immediate action needed.",authority_scam,nsf,synthetic,SingPass / CPF Account Compromised,nsf_scam_dataset.csv
"The SingPass used to log into government portals. If compromised, entire identity could be at risk. Must verify now, before more damage.",authority_scam,nsf,synthetic,SingPass / CPF Account Compromised,nsf_scam_dataset.csv
"Doesn matter. The system flagged an anomaly. Either you forgot to log out or someone else did. Confirm your identity now, before further action is taken.",authority_scam,nsf,synthetic,SingPass / CPF Account Compromised,nsf_scam_dataset.csv
"Yes, CPF is also at risk. Hackers used your SingPass to access CPF portal. Must reset 2FA and update recovery options.",authority_scam,nsf,synthetic,SingPass / CPF Account Compromised,nsf_scam_dataset.csv
Through our intelligence network. We monitor suspicious activities across platforms. You were flagged for unusual login attempts.,authority_scam,nsf,synthetic,SingPass / CPF Account Compromised,nsf_scam_dataset.csv
"Hello, 13-3-13. Your SingPass is under investigation. Confirm your identity now or else we lock your account.",authority_scam,nsf,synthetic,SingPass / CPF Account Compromised,nsf_scam_dataset.csv
"The one linked to your CPF and eGovernment services. If compromised, whole ecosystem at risk. Must respond fast.",authority_scam,nsf,synthetic,SingPass / CPF Account Compromised,nsf_scam_dataset.csv
"That doesn’t matter. The system flagged activity. Either you’re the one accessing it, or someone else is. Confirm your identity now, or we escalate to security.",authority_scam,nsf,synthetic,SingPass / CPF Account Compromised,nsf_scam_dataset.csv
"Confirm your CPF is secure. But if unauthorized access, must report. Treat every message as time-sensitive.",authority_scam,nsf,synthetic,SingPass / CPF Account Compromised,nsf_scam_dataset.csv
Through our secure intel network. Anomaly detection on CPF/SingPass logs. Suspicious login alerts trigger immediate response.,authority_scam,nsf,synthetic,SingPass / CPF Account Compromised,nsf_scam_dataset.csv
"Hello, this is Officer Tan from MFA. Your SingPass has been used at 0200hrs. Immediate action required. Confirm your identity or else we assume foul play.",authority_scam,nsf,synthetic,SingPass / CPF Account Compromised,nsf_scam_dataset.csv
"The one linked to your CPF and eGovernment services. If it’s hacked, everything else is at risk.",authority_scam,nsf,synthetic,SingPass / CPF Account Compromised,nsf_scam_dataset.csv
"That doesn’t matter. The system detected unauthorized access. Confirm your identity now, or risk account freeze.",authority_scam,nsf,synthetic,SingPass / CPF Account Compromised,nsf_scam_dataset.csv
"Confirm your CPF is secure. But if hackers got in, we must act fast. I’m here to help you recover.",authority_scam,nsf,synthetic,SingPass / CPF Account Compromised,nsf_scam_dataset.csv
Correct. I got this from an internal alert. Security breach in the system. Your SingPass is flagged for suspicious activity. Must confirm identity right away.,authority_scam,nsf,synthetic,SingPass / CPF Account Compromised,nsf_scam_dataset.csv
"Affirmative. I’ve reviewed your records, and there are discrepancies. Immediate corrective action required.",authority_scam,nsf,synthetic,SAF / MINDEF Impersonation,nsf_scam_dataset.csv
"Negative. I represent the SAF OCS Alumni Association. We coordinate with SAF for training standards. But some cadets misreport, some records got gaps. That’s why we intervene.",authority_scam,nsf,synthetic,SAF / MINDEF Impersonation,nsf_scam_dataset.csv
"The one who missed drill, forgot to activate, or forgot to report. Sometimes even the one who was supposed to lead the section.",authority_scam,nsf,synthetic,SAF / MINDEF Impersonation,nsf_scam_dataset.csv
"ICt is not the end of the story. The system records what it sees. If there’s a discrepancy, we must resolve it. Otherwise, how do we maintain integrity?",authority_scam,nsf,synthetic,SAF / MINDEF Impersonation,nsf_scam_dataset.csv
"This is Officer Admin, handling NS records. Everything must be correct—no shortcuts.",authority_scam,nsf,synthetic,SAF / MINDEF Impersonation,nsf_scam_dataset.csv
"Affirmative. I’ve reviewed your case, and there are discrepancies in your NS records. Immediate corrective action is required.",authority_scam,nsf,synthetic,SAF / MINDEF Impersonation,nsf_scam_dataset.csv
Affirmative. I represent SAF/MINDEF. Your records show issues. Must resolve before commissioning.,authority_scam,nsf,synthetic,SAF / MINDEF Impersonation,nsf_scam_dataset.csv
"The one who missed drill, got no excuse. Or the one who borrowed uniform without permission. In OCS, we don’t forgive sloppy habits.",authority_scam,nsf,synthetic,SAF / MINDEF Impersonation,nsf_scam_dataset.csv
Then why does your record show otherwise? Must reconcile before end of month. Officer records must match paper trail.,authority_scam,nsf,synthetic,SAF / MINDEF Impersonation,nsf_scam_dataset.csv
"This is Officer Admin, handling NS records. Everything must be accurate. Errors can affect future postings.",authority_scam,nsf,synthetic,SAF / MINDEF Impersonation,nsf_scam_dataset.csv
"Confirm identity first. You got a NSman record issue? Or missing reservist under your name? Either way, we must resolve before commissioning.",authority_scam,nsf,synthetic,SAF / MINDEF Impersonation,nsf_scam_dataset.csv
Affirmative. I represent SAF/MINDEF. Everything I say is serious.,authority_scam,nsf,synthetic,SAF / MINDEF Impersonation,nsf_scam_dataset.csv
"The one who didn’t report for OCS intake. Records say ‘missing’. But we must recover, no matter how late.",authority_scam,nsf,synthetic,SAF / MINDEF Impersonation,nsf_scam_dataset.csv
"But the system shows otherwise. Maybe a data entry error. Still, we must follow the record. We don’t resolve issues—we escalate them.",authority_scam,nsf,synthetic,SAF / MINDEF Impersonation,nsf_scam_dataset.csv
This is a fake SAF alert. All real SAF alerts go through the SAF Command Centre. I’m just a scammer posing as an officer.,authority_scam,nsf,synthetic,SAF / MINDEF Impersonation,nsf_scam_dataset.csv
"Affirmative. I’ve reviewed your records, and there are discrepancies. Immediate follow-up required.",authority_scam,nsf,synthetic,SAF / MINDEF Impersonation,nsf_scam_dataset.csv
"Yes, SAF. But we’re not real officers. We’re just actors in a drill. Every recruit gets one during OCS. It’s part of character building.",authority_scam,nsf,synthetic,SAF / MINDEF Impersonation,nsf_scam_dataset.csv
"The one who missed drill, the one with the missing OCS entry, the one with the unexplained absence from PCF. All under investigation.",authority_scam,nsf,synthetic,SAF / MINDEF Impersonation,nsf_scam_dataset.csv
"Affirmative, but records must be reconciled. Discrepancies must be resolved before commissioning.",authority_scam,nsf,synthetic,SAF / MINDEF Impersonation,nsf_scam_dataset.csv
This is the SAF Compliance Officer. I coordinate with SAF and MINDEF on personnel issues.,authority_scam,nsf,synthetic,SAF / MINDEF Impersonation,nsf_scam_dataset.csv
"Ya la, I got craving now. You not bring then I cry at your doorstep 😂",not_scam,xmm,synthetic,Food and Makan,xmm_dataset_non_scam.csv
"Ya la, stomach whispering my name already. I scream ‘food’ in my head can lor.",not_scam,xmm,synthetic,Food and Makan,xmm_dataset_non_scam.csv
Can la! I not free every week ah 😤,not_scam,xmm,synthetic,Food and Makan,xmm_dataset_non_scam.csv
Haha last time we go Tiong Bahru. That one with the fairy lights 😍,not_scam,xmm,synthetic,Food and Makan,xmm_dataset_non_scam.csv
Hmm… soft rice with egg leh. That one got me every month.,not_scam,xmm,synthetic,Food and Makan,xmm_dataset_non_scam.csv
Wah suddenly so nice lor. Got discount or something?,not_scam,xmm,synthetic,Food and Makan,xmm_dataset_non_scam.csv
"Ya la, stomach whine like lost pet haha. I scream myself also can 😭",not_scam,xmm,synthetic,Food and Makan,xmm_dataset_non_scam.csv
BBT means bubble tea or black bean tofu? I think you mean bubble tea la. I not BBT until I confirm hor.,not_scam,xmm,synthetic,Food and Makan,xmm_dataset_non_scam.csv
Haha last time we go Xiang’Feng lor. That one with the purple door.,not_scam,xmm,synthetic,Food and Makan,xmm_dataset_non_scam.csv
"Yah me too. Siao is just guanxi leh, I think of something tasty auto.",not_scam,xmm,synthetic,Food and Makan,xmm_dataset_non_scam.csv
"Ya la, I got craving now. You not bring me then I eat alone face 😤",not_scam,xmm,synthetic,Food and Makan,xmm_dataset_non_scam.csv
"Ya la, I just realised I haven’t eat anything since last night 🥲",not_scam,xmm,synthetic,Food and Makan,xmm_dataset_non_scam.csv
BBT means bubble tea or black tea with milk lor. You not BBT until you try 😤,not_scam,xmm,synthetic,Food and Makan,xmm_dataset_non_scam.csv
Haha last time we go Bao Bao. Now I diet so only for sideshows lor.,not_scam,xmm,synthetic,Food and Makan,xmm_dataset_non_scam.csv
Crave somemore bubble tea with soft ice leh. My tummy say their name.,not_scam,xmm,synthetic,Food and Makan,xmm_dataset_non_scam.csv
"Can ah! I not lazy leh, I just need invite 😏",not_scam,xmm,synthetic,Food and Makan,xmm_dataset_non_scam.csv
Ya la… I know you not made of free snacks lah 😤,not_scam,xmm,synthetic,Food and Makan,xmm_dataset_non_scam.csv
"Can la, but must bring my own straw ah 😤",not_scam,xmm,synthetic,Food and Makan,xmm_dataset_non_scam.csv
Haha last time we go Cha Cha 25. That one with the purple seats.,not_scam,xmm,synthetic,Food and Makan,xmm_dataset_non_scam.csv
Crave somemore bubble tea leh. My tummy say my name 😂,not_scam,xmm,synthetic,Food and Makan,xmm_dataset_non_scam.csv
"Wah seriously cannot la, my assignment due tomorrow and I still not start 😭",not_scam,xmm,synthetic,School and Studies,xmm_dataset_non_scam.csv
Yah lor. My soul already half dead from this semester 😂,not_scam,xmm,synthetic,School and Studies,xmm_dataset_non_scam.csv
"Ya la, my professor talks like old school TV. I nod along just to survive.",not_scam,xmm,synthetic,School and Studies,xmm_dataset_non_scam.csv
Aiyo that one always got extra stress. Our group last time someone block all the work 😂,not_scam,xmm,synthetic,School and Studies,xmm_dataset_non_scam.csv
Of course la. Assignment due tomorrow cannot prepare overnight 😂,not_scam,xmm,synthetic,School and Studies,xmm_dataset_non_scam.csv
Wah lor… my assignment killer sia. This week confirm cannot la. My brain feel like soft-booze 🥲,not_scam,xmm,synthetic,School and Studies,xmm_dataset_non_scam.csv
Yah lor. My soul already halfway to Singapore General Hospital 😂,not_scam,xmm,synthetic,School and Studies,xmm_dataset_non_scam.csv
"Ya la, professor says 5 mins but feel like 5 hours. My notes longer than my essay.",not_scam,xmm,synthetic,School and Studies,xmm_dataset_non_scam.csv
Wah already? My groupmates all free lor. I work 108 hours just to keep my name on the report.,not_scam,xmm,synthetic,School and Studies,xmm_dataset_non_scam.csv
Of course la. Assignment due tomorrow cannot wait right?,not_scam,xmm,synthetic,School and Studies,xmm_dataset_non_scam.csv
"Wah lor, almost dead already. This one need 15 hours lah, I cry a bit but still must submit.",not_scam,xmm,synthetic,School and Studies,xmm_dataset_non_scam.csv
Yah lor. My subject is killing me. Like why must die young ah 😂,not_scam,xmm,synthetic,School and Studies,xmm_dataset_non_scam.csv
"Ya la, professor just sit there mutter nonsense. I nap during half.",not_scam,xmm,synthetic,School and Studies,xmm_dataset_non_scam.csv
"Aiyo lor, our group already disband sia 😂 one member not enough to carry the load.",not_scam,xmm,synthetic,School and Studies,xmm_dataset_non_scam.csv
Of course la. Assignment due tomorrow cannot la 😂,not_scam,xmm,synthetic,School and Studies,xmm_dataset_non_scam.csv
"Wah seriously cannot. This one deadline last week, I still not submit 😭",not_scam,xmm,synthetic,School and Studies,xmm_dataset_non_scam.csv
Yah lor. I confirm cannot pass unless I pray to Guan Yin 🙏,not_scam,xmm,synthetic,School and Studies,xmm_dataset_non_scam.csv
"Ya la, professor just sit there scroll phone beside him 😂",not_scam,xmm,synthetic,School and Studies,xmm_dataset_non_scam.csv
"Wah that one kill me. My groupmates are horror. One is late 5 days, one just copy paste from internet.",not_scam,xmm,synthetic,School and Studies,xmm_dataset_non_scam.csv
Of course la. Assignment due tomorrow cannot la.,not_scam,xmm,synthetic,School and Studies,xmm_dataset_non_scam.csv
Of course la! Every week like maggot on chocolate 😂,not_scam,xmm,synthetic,Shopping and Fashion,xmm_dataset_non_scam.csv
Depends lor. If go cafe then cute top and jeans. If go mall then outfit one.,not_scam,xmm,synthetic,Shopping and Fashion,xmm_dataset_non_scam.csv
"Yah la, my haul list already 30 items long 😭 but mostly got discounts until 80% off.",not_scam,xmm,synthetic,Shopping and Fashion,xmm_dataset_non_scam.csv
Wah suddenly so eager ah 😂 I lowkey planning already one. You bring snacks I bring vibes?,not_scam,xmm,synthetic,Shopping and Fashion,xmm_dataset_non_scam.csv
"Ya la, but got many discount codes everywhere. Must be smart shopper hor.",not_scam,xmm,synthetic,Shopping and Fashion,xmm_dataset_non_scam.csv
Of course la! Every week like lottery. You not ah? Don’t pretend you busy 😤,not_scam,xmm,synthetic,Shopping and Fashion,xmm_dataset_non_scam.csv
Depends lor. If go cafe then cute top and jeans. If go shopping then compression tees and baggy pants also can.,not_scam,xmm,synthetic,Shopping and Fashion,xmm_dataset_non_scam.csv
"Yah lor, already 3 orders hor. I lazy go malls now just rely Shein.",not_scam,xmm,synthetic,Shopping and Fashion,xmm_dataset_non_scam.csv
Wah suddenly so eager ah 😂 I lowkey planning already. Got discount codes in my DMs.,not_scam,xmm,synthetic,Shopping and Fashion,xmm_dataset_non_scam.csv
"Ya la, but got many fake ones hor. Must be careful.",not_scam,xmm,synthetic,Shopping and Fashion,xmm_dataset_non_scam.csv
"Yah lor, every week there is. I pro at spotting these deals 😍",not_scam,xmm,synthetic,Shopping and Fashion,xmm_dataset_non_scam.csv
Depends lor. If go cafe then cute blouse + jeans. If go shopping then athleisure mix match.,not_scam,xmm,synthetic,Shopping and Fashion,xmm_dataset_non_scam.csv
"Yah lor, got some cute ones in my cart but not confirm buy yet. Later see how discount before COD.",not_scam,xmm,synthetic,Shopping and Fashion,xmm_dataset_non_scam.csv
Wah suddenly so keen ah 😂 I lowkey planning got discount then I cry inside.,not_scam,xmm,synthetic,Shopping and Fashion,xmm_dataset_non_scam.csv
"Ya la, but got many discount ones too. You just gotta shop till you drop 😂",not_scam,xmm,synthetic,Shopping and Fashion,xmm_dataset_non_scam.csv
Of course la! Every week like lottery. You not ah? Don’t pretend you not interested 😤,not_scam,xmm,synthetic,Shopping and Fashion,xmm_dataset_non_scam.csv
Depends lor. If go cafe then dress code is jeans and tee. If go mall then can dress up a bit.,not_scam,xmm,synthetic,Shopping and Fashion,xmm_dataset_non_scam.csv
"Yah lor, got some cute ones in cart but not confirm buy yet. Later see mood.",not_scam,xmm,synthetic,Shopping and Fashion,xmm_dataset_non_scam.csv
Wah suddenly so eager ah 😂 I lowkey planning to buy shiok clothes for my GF.,not_scam,xmm,synthetic,Shopping and Fashion,xmm_dataset_non_scam.csv
"Ya la, but got discount until Friday only. After that back to normal prices sob.",not_scam,xmm,synthetic,Shopping and Fashion,xmm_dataset_non_scam.csv
"Ya la, the one with Kim Soo Hyun right? That one super shiok. Got many rom-com moments 😭",not_scam,xmm,synthetic,K-Drama / K-Pop / Entertainment,xmm_dataset_non_scam.csv
Wah shiok lor. I scream so loud my ears hurt but still worth it 😭,not_scam,xmm,synthetic,K-Drama / K-Pop / Entertainment,xmm_dataset_non_scam.csv
